,title,cluster
1400,It is the 3rd day after my seotopjasty operation. When I sneezed with my mouth open on my right nostril all the mucus and blood came out also I am able to now breathe through the right one. Is it normal for me on the 3rd day that I am now slowly able to breath through the nostril and I have blown my nose a few times should I stop blowing. Another question is that will anything happen to my nose if I laugh such as the nose shape changing or stitches coming off.,5
1418,"When I lay on either shoulder, the opposite nostril opens and I can breath. Sometimes I can feel the shift in my nose. To memory I have never been able to breath easily through both at the same time. Is this a deviated/ swollen septum or something els? My nose appears straight from outside.",5
1420,"I have very narrow breathing passages, particularly on that left side and nasal valve collapse. I have two questions. As he will do the limited septoplasty and turbinate reduction on the left side, will he only put the splints and the packing on the left side too? Second: I had a septoplasty and turbinate resection in 2001, but obviously it didn't work long term. Why does this happen?",5
1425,I feel my nose is crooked and one side looks bulkier than the other. :/,5
1427,"Had surgery 8 weeks ago and still suffering from congestion mainly from my right nostril. My right side feels a lot of pressure, like it is pulling upwards and my lip is a bit higher on the right side. Like something is pulling me entire cheek towards the top right side of my head. I feel better when I sleep with my head tilted to the right. The stuffiness is better and worse at times. Docs say I am fully open on my right, nothing structural but they can't figure out why I feel congested!",5
1441,"I have a sinus rinse where it goes up one nostril and out the other, at the end I always have to blow out a little bit (even though I was told not to blow) it's so congested I can't help it. I find it really hard to sleep also when breathing because of how wet and runny the nose is getting so I just put a piece of tissue in each nostril to dry it, will this effect it any different ? Also the actual septum is still wonky and not stmetrical will this change as it heals?",5
1445,"Hi, my skin has come away from the visible piece of septum on one side under the tip of my nose. It's not visble at all unless you pull it to the other side and I can breathe fine. However it does irritate me as it can become slightly stuck and crusty so I have to push it to dislodge it. It also worries me that it could get worse. I've looked up Divated septum and I'm pretty sure it isn't that as my septum looks straight, it's just the skins come away on one side. Thanks in advance for any reply",5
1447,"The nasal turbinates on my deviated side is small, and the turbinates on the open side is large. My doctor said that this is because the body naturally tries to normalize breathing. He also said that if I decided not to get the turbinates reduced during surgery, that the turbinates would adjust again in size to normalize breathing. Is this true? Is there any idea of how long it would take for the turbinates to adjust to the equal spacing of my nostrils after a septoplasty naturally?",5
1449,"
	i have a deviated septum on the left part of my nose and which makes my tip look different on both sides of my face on the right it does a hook and on the left it doesnt will septoplasty help this?
",5
1462,"When looking back at pictures from when I was two or three, you can slightly see that one side of my nose was higher than the other. As I have gotten older it has became very noticeable when looking at my nose. My right nostril is much higher than the left when looking straight at it, and when looking beneath my nose you can see the septum sticks out of my left nostril. If you feel inside my nose you can feel the septum curving out to make it stick out at the left. What can I get done to fix this problem?",5
1467,I had my turbinates cauterized five weeks ago and my breathing has definately improved. But when I sleep the right side of my nose sometimes get quite congested. Is there a possibility that this will get better? Thank you in advance.,5
1478,"When I was little I broke my septum. Now I have a deviated septum. It can be difficult to breathe on one side of my nose. It doesn't bother me much during the day, but at night, if I sleep on the deviated side, that side gets noticeably clogged. My ENT doctor recommends I get a septoplasty done. He said he would remove the cartilage& bone that is deviated. To me it looks like a lot of bone & cartilage to remove. Will my nose be weaker after this? Are there any other options or recommendations?",5
1480,I broke my septum when I was little. Now I have a deviated septum. It is hard for me to breathe out of my left nostril most of the time. Can an ENT doctor re-break the septum and set it straight and put some splints in there to keep it straight while it heals (without removing bone/cartilage)?,5
1491,"Hi, I had a septoplasty and Turbinectomy on the 24th of July. I am now nearly two months on, and still getting a lot of thick yellow mucus discharge. This is prodominately out of left nostril, which was the side where the incision was. Is this normal and when can I expect it to stop?",5
1534,"
	My right nostril bleeds very often, sometimes for no apparent reason at all. My nose is very slightly turned to the right (almost unnoticeable). My mom had nasal septum deviation. When I exhale through my nose much more air comes out of the right nostril than the left one, and if I block the right nostril when I inhale it&#39;s like my left nostril is congested, same thing when I exhale. I never broke my nose (at least not that I know). I think that&#39;s it. Thank you very much.
",5
1545,"My left nostril is small and almost closed when I breathe in, my right nostril is open and has a bump on the outside edge making my nose look very crooked. Can this be fixed with septoplasty? I do not want rhinoplasty , I can't afford it.",5
1557,"I had a septoplasty/turb. reduction done a year ago. Post-surgery, I've been feeling the nasal cycle to the extreme - one side is always congested while the other one is open. The only time that this congestion goes away is in when my heart rate goes up. One nostril will be completely congested, and I will simply jump up and down a few times and it instantly goes away. Immediately after I stop jumping, it comes back. The same goes for something like a presentation at school. Is this normal?",5
1568,"Fractured nose years ago, saw doctor immediately. No breathing issues but left with crooked nose & hard bony callus on right side of upper nasal bridge & slight convexity on left side. My nose appears large from left 3/4 view. Mid nose on right is concave but not much bothered by it. I'd rather avoid a septoplasty for financial reasons (no insurance). I'd like minimal tip & dorsal refinement. Is it possible to rasp the bony callus & have tip reduced without touching the middle 1/3 of the nose?",5
1579,"I have a deviated septum which is pushing into my right nostril and makes it look uneven. My nose is normal, but the right nostril makes it look really crooked. Will a Septoplasty without Rhinoplasty put my nostril back to its place and make my nose look normal again",5
1594,"The right side of my septum was used for a shield graft and strut graft. My nose & septum are now bent. I will get a revision using rib & ear cartilage for my tip, but I also want to reuse the shield/strut & sew it back to my septum or put that in a pocket. It has affected my airflow in my right nostril & made it dry. My septum is also very thin so I don't want to throw away huge chunks of it. Is this a reasonable, doable, or benefit request? I regret letting anyone cut my septum at all.",5
1596,"hello, i got septoplasty, tip narrowing, lateral and medial resectio, tip lifting, build own cartliage to make a bridge. I have breathing dificulties in th left side,my right side is looks wilder, my right ala looks wilder, and looks very tick, big, on the tip on the left side has a bump, inside this left nostril has a bump also,just right under where is the bump on my tip, on my nose bone is a discoloration,i have coloration under eye also,is this all due to swelling,i m 3 months post op thks",5
1601,"My nosetip is slightly shifted to the right but i breathe well through both my nostrils.But If I simulate the result of the rhinoplasty and shift my nose to the center my right nostril is obstructed.My question is: if I get rinoplasty and i straighten my nose, will my right nostril become obstructed (like in the picture )so as to require a septoplasty or does the rhinoplasty move the separating wall between the nostrils to the center ?",5
1602,My nosetip is slightly shifted to the right . My nostrils are not obstructed and I can breathe well through both of them.But when I simulate the eesult of the rhinoplasty and I shift my nose to the center my right nostril seems obstructed. If I get a rhinoplasty without a rhinoplasty will my nostril be like this? My question is: do I need a septoplasty along with my rhinoplasty to fix it even if my nostrils seem fine now when my nose is crooked?,5
1609,"After 6 years I have started to notice that one of my nostrils has become occluded. Before having my septoplasty/turbinectomy/rhinoplasty to correct my broken nose and preexisting deviated septum, I could hardly breathe through my nose at all. After the procedure, I had really great success and could for the first time could breathe through my nose again. Now after several years, it feels like after feeling inside my nostril it feels as though the septum is touching the other side of my nose.",5
1618,"Hi, when I was 14 my nose broke and was twisted to the far right of my face. I had surgery a week after to put it back into the Center, however, my nose is still slightly crooked which means that I cannot breathe properly from my right nostril. I am due to have surgery on Wednesday but the Dr has not made it clear what surgery it will be. Can my problem be fixed simply by re-breaking my nose into place? Thanks",5
1619,I was looking in my nose because one side is getting hard to breath out of. When i looked i have a huge lump underneath my skin. Its not hard and its almost covering the nasal passage on the right side. What is it???,5
1620,"I cannot breathe properly through the left side of my nose and doctors have confirmed that this is down to a deviated septum. I have been prescribed medication that alleviates swelling & consequent obstruction when I have an allergic reaction to things but the only thing that will solve the root problem is a septoplasty. As I can get this surgery on the NHS, should I treat it like I would a private surgery - ie, do lots of background checks on the surgeon they assign me and change it if need be?",5
1628,I had surgery 13 days ago I went in for septoplasty and ask if he would narrow my nose. I can't tell if my nose is swollen or is this my final result? It's hard on the tip and very sensitive. One nostril seems lower will that change? I had a bone in my right nostril remove and that is probably why my nostrils are different just wonder if different nostril could be because or surgery,5
1631,My nose has a weird shape and one nostril is larger than the other and I can't tell if it is a deviated septum or not. Can you tell?,5
1634,I am 67 and female. The right nostril leans inward and left tip is larger. Rib cartilage will be used this time. Is a 3rd septoplasty very much more dangerous than the second?,5
1650,"According to my ENT, my deviated septum was rather severe -one nasal cavity was completed blocked. I am still struggling to breathe through my left nostril (which was previously blocked). When I look up my nose, the opening of the left nostril is very very small compared to the right - scabs don't appear to be blocking the nasal cavity. I am concerned that my deviated septum was not corrected during the surgery. I've had numerous follow-ups with the doctor, who says that I need to give it time.",5
1655,"I'm almost positive I broke or fractured my nose. I got hit in face\nose with a brick. The trama literally knocked me out, off of my feet. When I woke up i had blood from my nostrils , both my eyes were already bruising. Now after 7 years I've noticed my nose is still shifted to the right. I still have a huge hump in my nose and my right nostril is slightly smaller the the left. I snore sometimes and oft.en wake up with a dry mouth. Also if surgery needed how likely will my insurance help pay?",5
1656,"My septoplasty was last June, it is about 11 months since I had it. I feel like my right nostril is smaller than my left nostril.My left side is lending onto my right and I have an ident on my right side of my tip.My lip line between nose and lips is not straight, making my top lips look uneven with my bottom lip sometimes. I love my angle but the front of my nose looks uneven. Please could you tell me if this is still swelling or is this almost healed and these might be my final results? Thanks",5
1660,"I have very wide nasal passages but my nasal pathways have undergone a lot of trauma. First, I had a bad surgery resecting too upper lateral cartilage from the left side. I also underwent SMR rhinoplasty with tip deprojection. Now I feel like the structures in my nose can't compete with my lungs & I'm short of breath. If I manually the nostril or pinch my tip on the side where septal was harvested, I can breath w/out pain. Eye/ear pain bad on the left. How can I explain this to a surgeon?",5
1665,"One side of my nose is half blocked and my breathing is proper only on other nostril. I guess this happened due a nose break I had in my childhood, but not sure if that is the cause of it. Please guide me on how to rectify it as I have trouble breathing during the winters.",5
1675,"I had septoplasty, rhinoplasty, turbinectomy & sinus surgery about 2 weeks ago. Reason; my right nostril was almost always blocked while my left nostril was fine, & when I tried to breathe deeply & hard with my nose, my right nostril didn't move while my left nostril closed. Now, I still realize that my right nostril sounds stuffy but my left nostril is fine but moves when I breathe deeper. I guess I might have allergies too, but why is it ALWAYS my right nostril ?! Does it get better?",5
1676,"One of the main reasons for the procedure was that I had permanent mucus on my throat. Now I have more mucus and I wake up with headaches (on both sides of my forehead). Is this normal? Sometimes I feel like I run short of air, my Dr says that the final results will come in 12 weeks.",5
1677,"I had a medium-severe deviated septum that I decided to get fixed on my health insurance, for all the normal reasons. Since getting out of surgery, while the septum is in far better position than before, my whole nose now looks crooked, visibly twisting over to one side. It is very noticeable. My question is: will this improve over time, and what can i do about it if it doesn't?",5
1680,"I have a significant blockage in my left nostril. Sometimes I can hold the right nostril shut and blow air out of the left but seems to flap shut and not allow intake. Sleeping is often disturbed with congestion that closes both sides but especially the left. Rolling over sometimes allows return to semi normal breathing from one side or both. Have flushed nasal passages with baking soda and salt, getting some temporary relief. Mucus that comes out is almost always clear.",5
1684,"I had septorhinoplasty to correct a deviated septum and remove a bony lump on one side of my nose caused by injury. At first after the surgery my nostrils looked even (in fact the opposite one to the original one looked a tiny bit bigger) now 3 1/2 weeks later the original small one is getting smaller every day. Is it going to go back to how it was before, was the surgery a complete waste of time? I really don't want to go through another surgery. What has caused my nostrils to be like this?",5
1686,"
	I'm 5 weeks post-op. My right nostrel is now NARROWER &amp; no air comes through it! My left nostrel is ok unless I'm lying down. It feels like there's an OBSTRUCTION in upper part of my nose where the bone is. It aches. I also have ear-ache when I'm lying on my sides. My surgeon said it can take 6 months for swelling to go down &amp; recommends antihistamines, but I'm wondering if I have enlarged turbinates? Or whether he's right and this is normal &amp; I will get better?!
",5
1695,"Hi there. Since an accident involving a football that occurred some 18 months ago I have been left with a deviated septum (at least this is what 1 consultant has told me) - and difficulty breathing through my right nostril. I have been recommended a septoplasty but am not sure this is enough as the deviation seems to be in the bridge itself, with the bone fractured. Will a septoplasty include work internally to the bridge and improve my breathing on this basis? Thanks",5
1698,"I experienced a nasal trauma after rhino that shifted the entire nasal tip to the left. I also went through a poor revision that left a lot of issues unaddressed (nose still crooked, concavity on left side & extra fullness on left, probably due to nasal tip cartilages being moved). How can I tell one from the other in order to plan fixing my breathing/aesthetic appearance? I'm scared if I overcorrect it will make things worse & I'll end up worsening my breathing.",5
1699,"Of course since i have not been to a doctor yet, i do not know if it is only my cartilage that is crooked. But i ask because both the wall and tip of my nose are crooked. The airflow in my right nostril is much less then the left. I believe the actual bone itself is straight, just when it gets done to the cartilage, and definitely towards the tip, it gets wonky. Towards the tip, it seems that one side is concave inward. So will a septoplasty by itself be a good solution?",5
1720,"I broke my nose at the age of 2. I can't breath through the left side of my nose, because cartilage is blocking the airway. The right side of my nose is fine. do I need to get a rhinoplasty to fix the crook on the outside of my nose? or will a septoplasty fix that alone?",5
1723,"Hi all, I have quite a bad deviated septum (at least i think it is that) that blocks my right nostril almost entirely (if i look up i see a red mass with a tiny gap down the right hand side) - my external nose crooks to the left. Anyway i've noticed that i cant taste as well recently, certain foods taste blander & i cant smell that great, its really getting me down &im worried its something sinister causing it rather than my deviated septum. If the deviation is the cause can septoplasty fix it?",5
1728,"As a child I had a bad fall on my nose. Ever since it has gradually got worse over the years. I have trouble breathing from my left nostril and I have a poor sense of smell. I can feel a split at the front of the tip. Also if I squeeze my nose tip it feels springy. I'm not sure if this is related, but I suffer with nose bleeds alot too",5
1736,Five years ago nose was injured slightly in accident resulting in a slightly deviated septum. A year later started to get frequent excessive nosebleeds out of one nostril only that cauterization has not cured. Will a septoplasty help or have no effect on the bleeding . Blood vessels on left side of septum are very prominent upon examination.,5
1742,I mentioned the bump on the right side of my nose and also the fact that I still can not get air on the same side. He told me the right side is still very very swollen and my nose valve when I breathe in seems to shut. So I can breathe out .. but not in without my nose closing. When I go back he is going to see if any swelling went down and if not .. he is going to have to surgically open my nose valve. How bad is this surgery? Ive attached a pic of the bump on the right side.,5
1747,"My breathing is mostly just through one nostril at a time, I know this is a common phenomenon but I had read that in cases such as mine where it blocks completely on the other side you can have turbinate reduction to improve symptoms. Is this something worth considering?",5
1760,"Great airflow in right side of nose and partial obstruction in left side. I looked in the left nostril and saw a focal bulge of the septum about 1 cm back which I think is causing the partial obstruction. It looks like it's at the suture line and has a little clot on it - after I sinus rinsed, the clot came off and it looked blue-gray and shiny (small amount of exposed cartilage?). Likely to require revision surgery, and if so, when to do it, and how big a surgery?",5
1768,I had a surgery 1 year ago to fix septum but it is still deviated (no improvement) and i feel that one side is very dry and sometime i can't breeth well. If i do the surgery again will it be corrected?!,5
1771,"I have a deviated septum filling my right nostril 90% ish and externally leans to the left quite marked. In the last year ive started noticing my smell is hindered and testing it my left nostril even though clearer isnt as good as my right. My ENT specalist tells me i have a curved C septum, could this cause my loss of smell on that side. He believes it could be viral but im worried it might be first signs of Alzheimer's as per the peanut test of left/right impairment. Im considering septoplasty",5
1778,"My septum is slightly deviated to the right. I've gone to 3 ENTS and none of them recommend surgery. They claim that everyone has a deviated septum. My septum blocks my right nostril, so the surgeon said if he tried to move it it would just block the left nostril. however, my nose is VERY small and short, and i think the slight deviation is causing way more blockage than he realizes, sometimes i cant breathe thru that nostril at all. what are my options? i dont want to live like this:(",5
1779,"My cartilage blocks my right airway. I think I would rather have it straightened and pushed back to the middle instead of having it removed, because removing it is not natural and wouldn't removing even a small part risk the structure of my nose collaping/messing up the shape of my nose? Also, I was not born with a deviated septum....I got it from an injury. So the cartilage will not bend back or shift again, right? It's been deviated for a year now.",5
1787,I have a deviated septum curving to the right of my nose. my right nostril is larger than my left and hangs closer to my lip then the left. Also from a profile view the left side of my nose differs from the right. Does the deviated septum cause this? I want to know what the most minimal thing can be done for a more symmetrical nose that compliments my face.,5
1795,"hi ,ive got a blocked nose every single day , right nostril is completely blocked and the left allitle. its been like this for several of years. and also my nose is very sensitive . can it be extra meat ? what can i do to solve this problem ? thanks",5
1797,My nose consistently feels just a little stuffy. Whenever I start to get a cold I get heavy pressure in my forehead and bridge of nose. If I push up gently on the bridge I can breathe clearly and the pressure goes away (I hear a gentle click on left side). Why is this? Can I do anything to clear the stuffiness for good?,5
1812,"Hi, I have a deviated septum. I went through Septoplasty thinking that it's the last resort to cure my crooked nose but didn't get the desirable outcome. I don't know what went wrong. The structure of my nose still remains the same and my cartilage or bone still seems to be tilted or deviated towards my right. The attached picture shows a compilation of different angles of my nose: Center, Left Side and Right Side. I need your comments and suggestions on this.",5
1819,often i can only breath thru one side but shifts to other but still only on one On rare ecuations i can breath thru both but dosen't feel optimal Ive taken sprays and i dont have allergi the cartilage on the end tip leaning to the left i assume its the cartilage thats leaning you cant see it in the picture but it does stick out like a drop on the side of tip i might got deviated septum im wondering if its only a deviated septum or do you think its something more,5
1820,Hi! I had a septoplaty with a turbinoplaty a year ago and since then i'm having some problem.Everytime I breathe I feel a burning sensation and I lost a bit of my sense of smell too.It's weird because the problem is only on my left side.I told him that i fell better when my nose is block otherwise i fell that there is too much air passing through and its burning.He told me that he could try to put it like before by putting a bit of my septum cartilage on my turbinate.So is it possible?,5
1822,"When I touch the sides of my nose, I feel the bone in the middle kind of shift/move around. It almost makes a slight cracking sound it seems like. Is this normal?",5
1825,"I had a septoplasty surgery in June of 2014 to correct what another doctor had done. My nose became very narrow on the left side of my nose (it wasn't narrow before). After this surgery my nose still feels the same,blocked on one side. I'm not happy at all with the surgery, Because of this I keep getting migraines almost everyday, feeling tired because I'm mouth breathing all day. So I wanted to know how long should I wait before trying to correct this problem again? Thank you!",5
