,title,cluster
4,"i have noticed asymmetry in my nose from the front as well as the side. I also have a slight bump on my nose which is more noticeable on one side then the other. I also constantly feel like one side of my nose is more blocked then the other, do i have a deviated septum?",5
5,My 16 month old headbutted me last week. I just had a septoplasty in July of this year because my 2 year old headbutted me and I couldn't breathe well on the right side. Now I cannot breathe well on the right side again. Can you tell if this is a deviated septum. There is a reddish pink area that I think I see blocking the opening.,5
21,I have a flat nose with a button tips that I do love but my nostrils are uneven. The left side is higher and more narrow but the right side is wider and lower? I love my nose and don't want to change the shape of it. But my uneven nostril make my life a living hell. I even have post nasal drip and dry mouth I don't know if it linked to my nostril shape. Anyways what treatment can help me even out this problem. Septoplasty? Fillers? Help thank you,5
33,"Would I be a good candidate for a Septoplasty? My nose is crooked, mainly towards my right nostril. My breathing feels slightly restricted but it's hard to tell as it's been this way forever. It also bothers me that it's so sideways.",5
41,My ENT consultant said that I have a deviated septum and he said some cartilage would be taken from my ear to build up the left nostril but that would make my nose look wider and I dont want that. My left nostril appears higher up than my right one too. Would the nostril asymmetry improve just with a septoplasty?,5
43,Ive seen two different doctors. One an ENT and the other a plastic surgeon. I have a deviated septum and my nose is starting to tilt more on the right side. Can a septoplasty and fixing the deviated septum fix this or should I get a septoplasty and rhinoplasty. I dont really want to change the look of my nose I just want it to not tilt to one side as much. When I breathe in my right nostril caves in aswell which I believe is called a nasal valve collapse. I also have very bad tmj.,5
46,"I had a septorhinoplasty two years ago. Because of trauma to face, i redeviated my septum and also collapsed a nasal valve on the right side. My nose bridge no longer looks as defined as it did post surgery, and surgeons have told me that septoplasty is required. an ENT put a camera in my nostrils and showed me the wall shifting to one side extremely. also, inhaling makes my nose collapse on one side. He says goal is to make my right side of nose(collapsed) look like the left. is this possible?",5
59,"Pictures below roughly provide the positioning of my cartilage. How likely is this to be causing my impeded breathing and sinus pressure in cold weather? It's extremely uncomfortable/distracting physically, gets caught on the right side of the septal wall when moving my face and is irritating/drying the lining of my nostril. I also have maxillary lateral incisor agenesis on the left, same side of the septal deviation(coincidence?) and I'm planning an implant which requires bone grafting.",5
62,Im having a rhinoplasty &amp; have a deviated septum. Do I need a septoplasty if i breathe much better out of my left nostril &amp; barely through the right side 95% of the time but sometimes when i lay down it switches &amp; I can only breathe out of the right side but never both at the same time well. Will a septoplasty help me breathe through both sides at all times? I also have a crooked nose that I want fixed &amp; a dorsal hump. Will a septoplasty help straighten my nose more as well?,5
65,"I suffered from trauma to the nose area at age 14. Ever since then, I cannot breathe very well from my right nostril. At 42, Im finally trying to address the problem as it seems to be affecting my sleep even more now. I had a CT scan to diagnose if I had a deviated septum. Results came back normal. Can a CT scan come back normal but a deviated septum exists that causes the nostril to be partially blocked?",5
74,"I have severe nasal congestion and mucous diacharge thorough out winters to the point that it disturbs my sleep. I have almost no sneezing. My doctor said I also have DNS and inferior meatal hypertrophy and should have a septoplasty done so will it help? Also I have a bump on the left side of my nose where the septum is deviated and I feel the bump has increased in,size over time(others have observed too) will septoplasty correct it too? I'm 23",5
80,"Last year I had a septoplasty to improve my breathing and help with snoring, my nose wasnt that crooked before but it did lean to one side, after my surgery I did notice that it was still leaning over to one side and the doctor had claimed I had a perforation in my septum now as well, I waited a full year to see if it would straighten out and it never did my breathing only slightly improved but I still can only mainly breathe through my left nostril",5
89,So will this surgery make my nose more symmetrical as well as help my breathing ? Will a septoplasty make my nostril thats smaller and higher up more even to the other? I cannot breathe out of the nostril thats smaller and higher up,5
94,"I can barely get any air through my obstructed nostril. Right now, it takes me about 8s and 36s to inhale and exhale through my unobstructed and obstructed side respectively. I would like to know if this is normal or if I should get my deviated septum fixed. Some sources say it's normal to always breathe through one nostril at a time, others say one side should 'inhale more air than the other', while again others say it's 'noticeable while having a cold'. So which one is it?",5
97,I had a bad result with a rhinoplasty 26 years ago and it left my septum visible in my right nostril and my left nostril bigger thanks right.&nbsp;Will a septoplasty straighten my nose?Will a septoplasty sort this out?,5
109,"If so, what treatment would I need to correct this? And, could this be the reason why I don't like the way my nose looks currently? I feel it may look wider on one side than the other? Does this affect the outer appearance of one's nose?",5
127,"I had a severe deviated septum as a child and as a result needed two septoplasties, one at 17 and another at 19. My septum curved back a bit after the first surgery and I stopped being able to breathe out of both sides of my nose, necessitating the revision. Since the revision surgery 8 years ago Ive been able to breathe functionally. The bottom of my septum is still curved but at this point its a cosmetic issue rather than functional. Can that curve be straightened or is it too risky?",5
133,"My nose is crooked, I can't breathe out of my right nostril and my nose curves to the right. And I always have a sore throat if that had anything to with the problem.",5
145,"I refuse to accept the answers this is just due to being swollen. My breathing was perfect the first couple weeks after surgery then just declined. Saw another surgeon for 2nd opinion said 80% blocked left nostril and 50% right. My nose seems wider due to spread grafts, still curved and worse breathing than before surgery. I feel this is not my fault but now burden of a revision what are my options?",5
146,"I have a significantly deviated septum which is taking a toll on my self esteem. Both sides of my face are vastly different in appearance. I'm actually very happy with the appearance of the left-side of my face and shape of my nose etc, and would like mostly to have both sides look more like the left. Is this possible thru surgery? Will I be able to keep my original nose shape but correct the asymmetry and have both sides look more like it is on left?",5
148,I received Septoplasty 2 years ago to straighten my deviated septum. I still cant breathe right and I feel like my right side of my nose is collapsed and my nostril looks uneven. Please help me look into this. Thanks,5
152,"About five years ago, I had a septoplasty with turbinoplasty to correct a deviated septum and to help alleviate chronic sinus infections and headaches. In the years since the surgery, I've noticed my left nostril has changed shape and has a bit of a ridge that you can feel that pushes outward, rather than allowing my natural curve in my nostril. I'm wondering if this could be from the surgery or if it is something else entirely.",5
153,"I had my procedure almost exactly a year ago and after about 4 months, my right nostril became noticeably higher than my left nostril. What could be the cause of this change in position and can it be fixed?",5
157,"I have always noticed my left nostril is much larger and more wide than the right, and I find it more difficult to breathe on the right side. Do you think I need and would qualify for a septoplasty?",5
173,"I had a septoplasty in 2016. Was deviated to the right. I now find myself blocked on the left. The right side is now ok Mucosa is inflaming to a point where the left is blocked. Pressurised environments also affect on the left, being in cars and trains. My mucosa was always susceptible to rhinitis however it seems that moving septum more to the left the inflammation that once was not an issue for the left is now an issue My breathing is good at times but these are short occasions Any advice?",5
175,I had a septorhinoplasty about two months ago and I noticed a very tiny hole where my septum is on the inside of my right nostril (I am not sure how deep it is but it is about the size of a dot mark made by a thin pen) sometimes I notice it makes breathing more difficult when I inhale. Does a hole that size repair itself? Are there any treatments to seal it?,5
179,I cant breath from the right nostril and have a bump.&nbsp;I had septoplasty surgery in 2018. After the surgery my nose seemed fine for the most part until recently that a bump on the bridge on my nose appeared and I cant breath from my right nostril again.,5
181,"The first thing I noticed post sinus surgery and septoplasty was that my eyes looked different (less of the left eye is showing and more of the right eye is showing). Im also experiencing strain and stiffness in my right eye, especially when focusing on something. Doctors have not found anything on scans / MRIs and there is no enophthalmos. Does anything jump out when looking at these photos? The sinus surgery was over 14 months ago. Thank you.",5
186,"I am sure my nose was always slightly like this, but in the past year or so I have felt that my nose became increasingly crooked and it became harder to breathe out of it (one side in particular). When I look in photos, it seems to be even worse and the under view looks to me like a deviated septum. Is this just a deviated septum and is septoplasty the appropriate fix? If so, what is the process for doing so (do I start with a GP referral?), and what is the estimated cost?",5
188,"I have a small white piece of what looks like bone sticking out of my septum on one side of my nose (the originally deviated side), this side of my nose is also more sensitive and if i lightly touch that side, I can feel it in my whole septum. I have been very careful not to bump my nose and have been sleeping elevated since the surgery, I use q tips soaked in saline to clean the nose and apply antibiotic treatment. Could my septum have shifted on its own and caused the cartilage to expose itself?",5
198,"Fine with my nose shape, but it looks like it leans left because of the lateral cartilage? Also looking into maybe a lip lift simultaneously if anyone has any information on that/doing it at the same time.",5
203,i got septoplasty and partial turbinate reduction(IT and Mt 10) on right side weaks before I can feeling air sensection on right side of nose how much time it take to turbinate nerves to heeal plz help,5
204,"Had a septoplastia rinoplastia (more septoplasty) on my right nostril as I couldn't breathe through it properly. Just had the surgery and upon checking when lifted my face to check my nostrils, it appears the outside tip of my nose appears bent? Also I was told excess cartilage was to be removed from my right nostril but still appears from the outside wider (sticking out) more than the left cartilage of the nose? Is this all normal for recovery?",5
211,The right side of my nose do get very stuffy compared to my left side.,5
214,"I can usually breathe through my nose, but only out of one or the other and not both at the same time. I do have a crooked nose, which may have been the result of sport related trauma when I was in high school. I am 22 years old now, and am thinking on getting it fixed. What procedure is right for me?",5
215,"Ive seen an ENT a couple years ago who suggested surgery, but I dont think my insurance covers it. Mostly Im annoyed that I cant breathe out of one side that always feels clogged and painful&mdash;but aesthetically I want to make my nose straight and symmetrical. The slant makes one side of my face droop and I cant stand it. What are my options?",5
222,My left nose still feels swelled and unnatural 7 weeks after septoplasty. Air flows are great but would this feeling of swelling goes away? I also have lots of mucus produced that seems to be trapped in the back of left nose.,5
240,&nbsp;Also feels like this side is now much smaller than the other side due to this scar tissue? I thought that septoplasty only involves working in the upper part of the nose? Dr says to give it time (its been 2 and a half months) already but I cant see it getting better- scarring too thick!?,5
243,"
	I&#39;m 23 years old, healthy, nonsmoker. I feel like my nose is crooked and throwing off the general symmetry of my face. I also have noticed my right nostril seems to be working noticeably harder than the left, and I often get nosebleeds from that side. Do you think I could benefit from these procedures? I wouldn&#39;t want to go through the procedure unless if I&#39;m just being overly critical. Thanks.
",5
246,"I went to an ENT specialist to have my nasal polyps removed. That was the only procedure we discussed and agreed on. While I was unconscious, he straightened my nose. I have an extra unsightly bump on my nose. Breathing is more difficult. To breathe through my nose I have to push up the left side of the nose he straightened. My left nostril is lower than my right. My left side of the lips is also lower than the right side. How can i get this reversed? His operation notes are illegible.",5
247,"I had a septoplasty on the right side of my nose in feb 2017 which went well and helped a lot with my breathing. Suddenly my right airway has blocked completely, I feel like I always need to blow my nose but I don't. Can't breath at night anymore. I've tried taking antihistamines and using my nasal spray, they're not any difference. Has my septum gone back to being deviated? The mucus is travelling down my throat and making me sick.",5
249,"Im 5 weeks post-op from septoplasty, tip refinement, spreader grafts. From the front view, one side of my nostril looks lower than the other, and from the side, it has more nostril show so it looks lopsided in pics. Is that swelling? Theres also a dent on bridge my doc says its swelling?",5
271,I had a septoplasty about five months ago and I still can not breathe and now my nostril is going kind of sideways and the other one is straight up up before they were going both straight up they were almost even to each other (nothings perfect) but now I have one completely off.,5
279,"Im about 3 weeks post-op and my follow up with my ENT is not for another three months. Ive been doing daily saline rinses, humidifier at night and applying neosporin/nasal gel. My concern is the feeling of tightness on my left side close to my nostril, where the incision was made. Is the white looking areas cartilage or a phase of the healing process? It is bumpy, hard and makes my nostril appear narrow compared to the other side. Mouth movement and eating seems to affect how tight it feels.",5
295,"I had a Septoplasty in April this year, all went well and I now can breathe a lot better through my right nostril, since this surgery and has got worse as the time gone on. My throat is extremely dry all the time, I cannot produce any mucus on the right hand side and to be fair I have very little on the left which makes my throat extremely dry that it feels like I have an obstruction/narrowed? Is this normal or is there anything I can do to help? Thank you Im advance. Craig",5
296,I am two weeks post septoplasty. I notice that when I scrunch my nose using both sides of my face my nostrils raise up.However I notice if I alternate the sides I do not get the same results. Right side scrunch will lift right side nostril Left side scrunch does not lift left nostril . I was told by a medical doctor not an ENT that it could be a severed muscle in the nose done during the procedure.,5
298,"How long to see improvement with breathing? Possible nerve/muscle damage? I could not breathe out of the left side of my nose. It was determined that I had a deviated septum. I had a septoplasty , columella reduction ( left side of nose ) and Bilateral inferior turbinate outfracture and reduction done 10 days ago. The doctor completed the septoplacy by accessing the right side of the nose (nostril with no breathing issues). Breathing has not improved on the left side. Swelling but no numbing .Able to move right side of nose up and down but not the left side .",5
302,"Dear ENTs I had a deviated septum surgery and&nbsp;turbinate reduction 2 years ago. I'm still&nbsp;congested on right side at night and had radio coblation a year later. Still&nbsp;no help. These photos are post both of the above procedures. At night, my right side swells tremendously to 100% blockage and the pressure wakes me up. Is there any help that I can receive for this? This CT is recent and is after all of the previous work. It is my current condition.",5
309,"I had a septoplasty in 2012; my septum re-deviated afterward but my nasal breathing was still greatly improved so I didn't feel the need to fix it. However the other day I got hit with a ball on the same side of my nose the septum had deviated to. It wasn't a hard impact, it doesn't hurt, but now I'm feeling like that side of my nose is congested or that my septum looks more deviated when I look in the mirror. Could the impact have weakened the septal wall causing it to deviate more than before?",5
313,"I donot have a major breathing problem, i am having repeated sinus infections and post nasal drips which causes sore throat. My nasal septum is slightly deviated to the right and i also have adhesion (from a previous surgery) near the middle turbinate on the right side. My doctor has recommended septoplasty, he will also be removing adhessions. Will septoplasty put an end to my sufferings.",5
323,"All my life had a sever deviated septum blocking the right side. Hypertrophied turbinates on both sides. After septoplasty and sub mucous resection of turbinates, when just breathing through right side I feel out of breathe compared to left. They are not blocked both as equal as possible. Could this be that the mucosa on the blocked side isn't used to airflow and needs to adapt, as it always feels blocked so I know it's not just the nasal cycle.",5
326,"I had septoplasty and turbinate reduction 2 months ago, and for the last 6 weeks or so, I feel constant phlegm at the back of my left nose (incision made this side during surgery) and above the throat and I cannot clear it. It's always there and it's annoying. It gets worse when I eat or drink. Is this still an adjusting thing from my surgery? If so would this get better in time? Or should I consult the doctor? Thank you so much.",5
342,One side of my tip feels harder and perhaps even higher than the other. Is that a part of the healing process? I'm around one month post-op. Grafts used for the septorhinoplasty: Spreader On-lay Chips,5
349,"I had septorhinoplasty done 40 days ago. I had the width of my bridge reduced, tip refined and the height of my nose from the side profile reduced. Previously I had perfectly symmetrical nostrils but now they seem to be uneven. My right nostril looks slightly pointy as compared to the left one. The side profile from the right also looks different from the left. Can it be because of the swelling or is my right nostril notched? What can I do about it if its notched?",5
350,"Can someone help me here. I am 3 weeks out of this surgery. I thought I was only having septoplasty but then seen the other had been done to. I'm so scared of the horrer stories of people getting ens from turbinate reduction. . I go for a 3 week followup tommorow to see how I'm healing. The thing is, I look in the mirror and the turbinates look the same size as before surgery. The right side has always been bigger then left. It's still that way. Is this a normal looking size turbinates?",5
351,I had a septoplasty and it appears there is a bony protrusion in the back of the nasal cavity extending off the nasal sidewall on the Left side. Something feels different on the left side in a negative way that is not easy to explain but Im wondering if this should be removed or if it is even possible?,5
356,After a month of throbbing pain on the left side of my nose with numbness on my left cheek and a feeling of pressure my doctor said it is a nerve in my cheek. Will this go away? Its been 37 days since my surgery. I also have a small visible suture (absorbable) where the incision is an a small area that hurts.,5
396,"I had septoplasty and FESS 12 months ago and one side of my nostril gets blocked with hard crust that I cannot remove, it hurts and causes pressure on my face. My ENT says theres no issue. But I cant dislodge the crust",5
399,"I had a septoplasty done 5 days ago for my deviated septum. My right nostril is completely clear of gunk but my left is still completely blocked. When I shine a torch into it, there is a huge blob of gunk at the back of my nostril that just wont come out, no matter how many times I flush. I cant blow my nose yet as my septum is still healing, but Im worried this blob wont detach. Will this blob of gunk eventually come out? Im worried that it wont since my other nostril is clear now!",5
402,I had septhoplastic on my nose 2 months ago for a deviated Septum and had rhinoplasty to narrow my nose only the nasal bones were broken. The right side of my nose where the soft tissue is looks different from the left. Is this normal or might be scarring tissue that is not allawing the skin to flatten?,5
406,"I had septoplasty and turbinectomy about two months ago and Ive been following all the post op procedures, I had a really deviated septum and I thought itll be back to being straight which it isnt but I can slightly breath better from the gap as shown in photos. Is it normal to be like this ? Pics are shown of closed up nostril and left nostril which isnt blocked.",5
409,Im having septoplasty with a graft on my left nostril and rasping.&nbsp; My nose was broken twice once hit on the left side when I was younger. The resulted in my nose deviating into an S shape on the bridge rotating my top to the right. Ive had a consultation with a surgeon whom has proposed a septoplasty and a graft to my right nostril for support along with bridge rasping. Im surprised that it doesnt require breaking/resetting. Is a good result possible to correct the bridge with just rasping? Thank you in advance.,5
423,"I had a rhinoseptoplasty and endoscopic sinus surgery 1 week ago. Today I had my cast removed on the outside of my nose and removal of the packing inside of my nose. The packing on my left was not found. The left side was much more swollen and the surgeon made 3 attempts to try and find the packing. The left side was extremely painful and we stopped after the 3 attempts. He thinks I may have swallowed the packing on the left or that it is further up. It was so painful, I'm afraid to go back.",5
431,"I have underwent Septoplasty two weeks before due to Deviated septum. Now the pain has reduced and last day, The surgeon took off the remnants of the stitches inside my nostrils and cleaned my nose. Now my nostrils are clean but still I feel difficulty in breathing through both the nostrils at a time. When the left nostril is opened (can breathe very smoothly), I feel burning pressure and block in the right nostril. After some time, the same is happening vice versa. Is it normal",5
435,"I had closed rhynoplasty and septoplasty 2 days ago , I have a lot of swelling which I expected, but my diviated septum has diviated the other side compleatly blocking my nostril, is that because my surgeon performed closed rhinoplasty in the other nostril? Causing the septum to swell over to the other side ? Please help I'm getting worried !",5
436,Septoplasty- 05/22/18 A stitch blew in my left nostril yesterday and my left nostril is sore. I notice the left nostril opening is narrowing again. Is the surgery botched over one blown suture? And is it natural for the nostril to narrow post-op? Also- the stitch itself is very hard.,5
445,"I have a very small posterior septal perforation, and I get a slight 'twinge of discomfort' on my left side way back in my nose by my nasal wall and middle turbinate. I notice that when I cover my right nostril and breathe in the discomfort is gone. Perhaps the airflow in my nose is coming through the right side then through the perforation to the left and hitting my nose in such a way that it acts almost like a contact point irritation somewhere near the turbinate and bony valve?",5
