,title,cluster
1826,I had a septoplasty in June 2013 and then a valve repair in January 2014. The valve repair was due to a small bump on the right side of my nose which did not lay properly with the cartridge graft. Now there is a lump on the right side of the bridge of my nose. The bump has not changed for 9 months and still hurts to press on. I have been to my doctor three times about this and he has nothing to say other than it can take up to a year for swelling to decrease. It is painful and very unattractive.,5
1829,"In 6th grade i got injured,crooked nose. Now i breath hard and loudly. Mostly just from one nostril. Also a bone on my nose bridge is peeking out when i stretch it. And i think my septum is going more to the left,because when i turn my nose(with the nose musceles?)to the right you can clearly see the septum But if you do it to the left you can Hardly see it.",5
1833,"I had open septoplasty and tip plasty operation four weeks ago, also my doctor put graft to one side of my nostril which was&nbsp;collapsed. After the op my nostrils does not look symetrical. One side is more vertical the other one. I'm really dissapointed because it changes the whole look from the front. Can this be corrected? Thanks",5
1834,I had 2 septoplasty done by a plastic surgeon done w open approach ..I now have obstruction on the left side of the tip of my nose..The only thing that works is breathe rite strips,5
1835,In the last week I have noticed a partial blockage again in my left nasal cavity (the side that had a complete blockage prior to surgery). It feels exactly like it did before the surgery just not as blocked. Up until this point it was fantastic and both nostrils completely clear. What could be the cause of this? I've not noticed any change in my allergies at all and I'm otherwise completely healthy.,5
1844,"I had my deviated septum repaired more than 6 years ago and right now am suffering from sinus infection. I blow my nose real hard and felt a tugging or a sharp feeling on the inside and noticed in my left nostril the nasal passage is small, the septum looks a little crooked, but there's a flap or something in my nose that's swollen, red, and throbs. When I blew my nose I pressed my thumb on the right nostril to close it and blew hard on the left and I wonder if pressing my thumb crooked it.",5
1847,I got my second septoplasty op sept. 3. (Touch up op) but I'm starting to have blockage like before Where if I lay down on my right side I feel the right nostril starting to block until it stops working and I switch to the left it does the same thing. a point during that where the blockage is in the middle so I lay on my back to have about 15-20 sec of breathing through both and then last blocked starts to block again I'm worried that the Op didn't work or I messed it up by laying on my sides,5
1850,"Over three weeks ago, I had a septoplasty and turbinate reduction to correct a deviated septum to the right and to reduce the turbinates. I have two black stitches in my septum on the left side that ar towards the front of my nose that I can touch and now the right side of my septum looks caved in at one point and on the opposite side of that cave, there is a bulge out into my nostril. Now when I try to suck in air the left side is blocked.",5
1857,"I have had 5 nose surgeries in total. In order - septoplasty, rhinoplasty, rhinoplasty, septorhinoplasty and then a revision septoplasty, my nose has left me feeling depressed as one nostril is bigger and has cartilage sticking out, the bridge of my nose bends and both views from the side of my nose are different shapes to each other, can I see another surgeon ? All of them have been closed procedures, but my surgeon keeps on chopping away and the outcome either says the same or is much worse :(",5
1859,"My right nostril is almost totally blocked, looking up i have a big red lump in it with say 10% space on the right side. Today i went to my ENT who told me it was my septum deviated. I was meant to ask him why if its deviated that side does my entire external nose lean to the left side instead of the way my septum is deviated. I am sure their is a obvious reason for this that i am naive to understand but would like to know pls anyone? I am considering a septoplasty to fix the deviation.",5
1872,"You can see the front inside edge is uneven and the bump behind it. The bump goes from the front tip of my nose to the mid portion. It's probably a 1/4 of an inch long and about an 1/8 wide. I can push the bump in on the right side of my nostril but then it bounces back to its original position. I have been to three different ent doctors and they don't know. Please help everyone I talk to notices it immediately! Respectfully, Just want it fixed patient :)",5
1877,"I had septorhinoplasty 9 months ago to fix the breathing problems on my left side. My breathing was normal almost immediately after the surgery but then I started having problems again, this time on the right side. The left nasal passage is fine no matter what but when I lie on my right side I get this weird feeling in my nose as if something's shifting and I get congestion in my right nasal passage. What can it be?",5
1886,"About 3 years ago I had a septoplasty done and was not pleased with the results. One side is alright but the other was just made worse. It seems that their is a pocket of cartilage causing most of my airway to be blocked. It causes sinus pain and pressure, and is very frustrating. I want it to be corrected but I just don't understand why this happened in the first place and how I can be sure it will be corrected if I go through surgery again.",5
1891,While I was practicing i received a really heavy kick on top of my nose which made me pass out . Its always one side of my nose is completely blocked and the other half blocked ! When Im exposed to wind i usually get a lot of tears as well as red eyes . I'm allergic to many things . I recently notice my nose is a little bent to the left and my left side is where its almost all blocked . Will septoplasty solve this issue ? I would definitely prefer products which has permanent effects.,5
1894,"One nostril works great and I can see all the way up it. The other has tissue from the outer wall blocking the airflow towards the top of the nose cavity, I can't breathe through it at all and it has been this way since the day of surgery. There is also dried blood toward the nose opening on the septum side from an exposed stitch that bleeds sometimes. Is the blocking tissue just internal swelling. if so how long will it take to go away? What are the other possibilities besides swelling?",5
1901,"18 hours after septoplasty i blew my nose hard in my dream, in my dream the right nostril blew out mucus. I woke up and the right packing had moved down just a little bit not much. Now im experiencin a burning feeling right where they put the graft in the right nostril. I imagine this is the same as pulling out the packing 18 hrs after surgery. Chances I caused damage?",5
1905,"I have underwent Septoplasty three weeks before due to Deviated septum. Now the pain has reduced and last day, The surgeon took off the remnants of the stitches inside my nostrils and cleaned my nose. Now my nostrils are clean but still I feel difficulty in breathing through both the nostrils at a time. When the left nostril is opened (can breathe very smoothly), I feel burning pressure and block in the right nostril. After some time, the same is happening vice versa. Is it normal?",5
1906,"I've had such a hard time breathing though my nose after a few cases of light trauma. it's truly ruining my life and i just want to be able to breathe freely again. my nose was never broken and looks the same outside. but on the inside it always feels stuffed/blocked (no mucus), so I'm sure it's a structural problem. Right side is particularly bad. i went 3 Ent's and they all said my septum is not deviated and i have equal room to breathe, surgery was not recommended. could they be wrong",5
1908,"My right nostril is always blocked. my mom is urging me to live the rest of my life like this. i dont want to though. but she claims its risky to let someone cut open my nose and sew it back together. also, my nose will make scar tissue, which will just make my blockage worse. the problem is that my septum is only slightly deviated, so the surgeon thinks if he tries to fix it, it will just block the left. what should i do? my nose is small, the slight deviation causes me a LOT of obstruction.",5
1910,"I got my stents out I felt amazing bit since then my left nostril, is now completely stuffy and my left ear is full again.I had problems with my ear before the surgery.So I was pleased when it all went away.Now 4 weeks post op it's back.I'm getting put on antibiotics again.I've had 3 post op appts & a camera up there & my ENT said I'm healing good.I'm at the point of frustration.I just want to be better. I am a single mom & work a lot. When will I feel better and normal?! Please help. Teresa )",5
1915,"I had my 1st septoplasty 5 years ago because I couldn't breathe through my right nostril. I think the doctor overcorrected it because since then I couldn't breathe through my left nostril. I got 2nd septoplasty by another doctor 3 weeks ago. While the splints were in I could finally breathe though my left nostril! But after they came out 6 days after the surgery, I can't breathe again. Were the splints taken out too early? Did the septum shift? Will I need 3rd surgery? I'm so upset.",5
1918,"I had septorhinoplasty 3 months ago, and even though it still has more healing to do, I already know I am not happy with it. Nose has been crooked for years but before septorhinoplasty it sloped down on both sides. Now my right side is sloped but the left side is dented in to the point where the bridge sticks out past the wall. Can this be fixed and how? What do you think went wrong? I also cannot breathe. It feels like the bones are pushed against the septum.",5
1919,"I have this persistent blocked right nostril that is really annoying. I can somewhat breathe through it but at the back I can feel it is blocked by cartilage. I just want to be able to breathe freely through both. My mom says no don't get surgery, lots of people live with blocked nostrils and septoplasty is extremely dangerous/unpleasant. But this blockage is really annoying when I do sports/exercise. is septoplasty a hard operation? does it have a high success rate, honestly?",5
1924,I had a septoplasty and turbinate shaving done about 2 yrs ago by one of the best surgeons in my area..now I need a second surgery because I still cant breath through the left side of my nose. I also feel pain (pressure) in the area of my cheekbone and upper jaw. I recently had a ct dental scan and the doctor stated that the turbinates seem to be pushing against the bone on that side of my face which is why I feel pressure in my cheekbone. why wasnt this resolved with original surgery? Thanks,5
1928,"I'm 1 month post op from septoplasty with spur and turbinate reduction. The side with the spur and deviated septum is much better and most of the time I have reasonable airflow. The side that was perfect before is now stuffy all the time. ENT doctor said there is no swelling and plenty of room for air to pas so I shouldn't be having any problems. Can anyone explain why it's still stuffed up? Sometimes it's completely blocked but gets better in the shower or walking. Also, really bad at night.",5
1929,"After my surgery, 4 1/2 months later, I am experiencing pain on my bone. I also noticed my bone sticking out a bit, leaving a slight hump on my nose, and this is just recently. Also, one nostril is bigger than the other. Please help.",5
1937,"I just had septoplasty exactly one week ago, and the splints were taken out Tuesday. While waking up from bed this morning I accidentally bent my nose slightly against the pillow that I was sleeping on. Did this cause any redeviation to my septum? I can't really breathe out of one nostril as well, not sure if it's because of the healing process though. Can I ask my ENT to give me a CT scan for peace of mind? If I did redeviate my septum can it be fixed quickly as of now with little complication?",5
1944,"I had my surgery four months ago but the bump is still pretty prominent and I still can't breathe. Every time I blow my nose I get out a lot of blood and when I touch the tip of my nose lightly there's a weird tingling sensation in left nostril. Also, my right nostril is A LOT smaller than my left causing breathing problems too, which is really the whole reason I was able to get the rhinoplasty part and have insurance pay for it. He said he'd that too but I really don't think anything changed.",5
1946,"I have a devited septum on the right side, turbinates are swollen on the left side. if i fix the septum,, won't the turbinate swelling and compensatory hypertrophy issues resolve themselves?",5
1965,"Can picking your nose make you healthier?&nbsp;My septum leans to the right and I can't breathe through my right nostril at all. It's awful. Right now I can't afford septoplasty and I don't want to risk messing up the tip of my nose (even though I know risks are minimal.) The blocked nostril drives me nuts. If my septum cartilage is simply bent to the right, is it possible that if I put my finger up my nose and push the septum back into the middle, it will eventually bend to the middle? And stay that way so I can breathe?",5
1968,I broke my nose 6 months ago getting hit in the face and it is visibly crooked. I also have frequent nosebleeds from this and can only breathe through one side it also makes my nose clog up alot which makes me snore at night making it difficult to sleep. The right side of my nose looks flat which is where i got punched. if I do need surgery can I fix the breathing problem and crooked nose without having to pay anything as insurance covers?,5
1969,"I can't breathe through my right nostril. I really can't handle the idea of surgery, but I really can't handle the idea of having to wake up with this awful, blocked nostril for the rest of my life. If my nasal septum is pushed to the right of my nose, can I push it back without breaking? my doctor said it was the cartilage was deformed. So can't I gently push on my nose and move my septum back into the middle without breaking it if cartilage is malleable? Will this help my breathing over time AT ALL?",5
1976,"I used to have perfect breathing. But then I got body dysmorphia (didn't like the bump on my nose) and pressed on the bridge of my nose. Eventually I gave myself a deviated septum, because for months my nostril is CONSTANTLY blocked on the right. It's bugs me:( surgery SCARES me. if my septum is deviated to the right, can I push the cartilage back with my fingers to the center so can breathe right again? btw my doctor said pressing on my nose did not cause the problem....is he wrong?",5
1983,"for some reason, Ive developed two lumps on the bridge of my nose. They are on both sides and probably the reason why I've been having post nasal drip and a runny nose. I also find it hard to breathe from my right nostril. I think i may have a deviated septum. What do you guys think?. Ps: I'm also suffering from nasal polyps.",5
1993,"Hello, My nose slightly goes towards my right side, I think because of a fall when I was young. My friends and family say that in person it's not noticeable, but I see it really strong in pictures. I was wondering if a Rhinoplasty would be a good idea: because the deviation is minimal, I'm afraid it will be risky (like an over correction, or that it goes to the other side). I am also concerned about the recovery time: has a septoplasty the same recovery time as an open rhinoplastic? Thank you, Grace",5
2015, I had some sinus surgery and my deviated septum fixed a few weeks ago the splits have been removed but I can fell somthing inside my right nostril on my septum and the area is so sore I can see a piece of clear string in the area that is so sore. Is that normal? When will this come out if it is a stitch?,5
2022," I had my nose broken twice and although last time it was re-set, the nasal bone is still mis-placed. The centre of the nasal bone is in alignment but where the bone meets the nasal concha on the left, it's knocked in and on the right side it's knocked out. How simple a procedure would it be to correct this? Ie, would it just be a case of a Rhinoplasty to knock each side back into place (out and in) so that the nasal bone and nasal concha meet at both sides? Thanks! :)",5
2026, I had a revision septoplasty done .septum had turned and buckled ..it was done 1 yr ago ..no turbinate work was done and no cosmetic surgery was done .just straightening the septum using an open approach ...how long till the swellin g is gone ...I was not able to breathe freely on the left side ...so now I still feel congested on the left side after 1 month ..dooes this take a few months to finally feel subside ...I am also using a nasal steiod spray ..,5
2027, hello sir I have deviated nasel spectrum(dns) to the left side. it makes me difficult to breath so I decided to perform the septoplasty. and I have done it.. after septoplasty all is fine till 3 month but now my nasel spectrum again get bent .during the operation the doctor remove my one side bone and show me. so there must a single bone .. now it again deviated am confused what should I do .again perform septoplasty ?? if I did so they will revome my remaning bonebor they just put the splint.,5
2032," I had a dull, burning, pressure feeling (pain) inside my nasal cavity (right side). ENT noticed a severely deviated septum. Septoplasty unfortunately worsened the pain. Its radiating over my right cheek to my right ear drum (burning feeling). My ear drum seams to twitch as well. The cavity itself feels bruised and burning (this wasnt so before the surgery). Like it just had surgery, which isnt the case (surgery was 9 months ago). Neurologist (MRI) didn't find anything wrong. Please advice",5
2034," I can't breath well through my nose as a result I end up breathing with my mouth open when I sleep, its so annoying, I can't even sleep through the night sometimes. Also, I notice that my nose is crooked, is that because of a double deviated septum? I can feel the septum go the the left and then sharply to the right near the tip of my nose.. Does insurance cover the cost of having the septum fixed so I can breath better? Thanks!",5
2040," I recently had a septoplasty/turbinoplasty (6 days ago) and I had my splints taken out 2 days ago. My nostrils are starting to even out and I think this is due to the decrease in swelling of that area. I feel like the hole in my left nose airway is 1/3 the size of the hole in my right nose airway. When I breathe through my nose now , it feels like I get so much more air through the right side of my nose than my left. This doesn't feel good. Aren't I supposed to have even airway?",5
2044," I have small left nostril , i don't get full breath, right notstril is good. Some times i get left side chest muscle pain and goes off after some time, i researched and found it could be the Primary spontaneous pneumothorax. And my left side of the face is little tilted , right side is more pronounced, i have cross bite teeth. My goal is to get full functional breath. Please suggest me.",5
2046, I had septorhinoplasty 6 days ago and keeo waking up to find ive shifted onto my side during the night. I managed the first 2 nights on my back but have been sleeping on my side since. Could I have ruined my nose?,5
2062," I had my septorhinoplasty 6 months ago, my nose gets blocked all the time but it feels better when I lay back slightly with my head leaning back, my right nostril is still closed, it feels like smthn is blocking the airway up my nose, the plastic surgeon said that my valve went down a little after surgery, is this normal? this was the nostril that was wide open before the surgery, is this fixed at the clinic? do I need to consult with an ENT?",5
2072, Face has rapidly aged only on one side of face - kind of hollow/dark near eye/tear duct + deep nasolabial fold &amp; sagging! 1 1/2 years ago I got a septoplasty + turbinate reduction because my ENT said I had a deviated septum. Sometimes I feel pressure through nose when breathing in &amp; uncomfortable airflow. Also been told by my orthodontist that I have an open bite which is bigger on right side. I sometimes strain lips to bring them together and think this might be part of the issue.,5
2075," 21 year old male. The tip of my nose leans to the right ever so slightly. I noticed also that when I tilt my head up in the mirror, my septum appears crooked(leans towards the right side a tiny bit). Is this even worth correcting at all? I have no breathing difficulty but I feel that a surgery might bring more balance to my face(more symmetry)",5
2082," My left side where i had the deviation and spur feels tight and collapses in when i breathe in, was fine for the first 3 weeks, is this normal. Also still completely congested on the left side but totally fine on the right. Thanks for the replys.",5
2097,"
	I had septoplasty done about four months ago. My surgeon did a turbinate reduction and removed a growth spur, but my right nostril is still blocked. The surgery seems pointless and actually caused more damage, since it blocked off my nostril completely. Would I need another procedure done?
",5
2105,"
	I had a septoplasty (septum and caudal) in January. I was told I had extra caudal on one side and the excess. would be trimmed. When I looked at the results from the new cat scan you can see that my caudal is not on the midline. So he trimmed it instead of resetting it. When I brought this up to him he said that you can't always get the septum straight and the important thing is that it looks better than before. Can a get a revision by another dr. that would it still be covered by insurance?
",5
2107,"If not, what rhinoplasty procedure would be best for me? One nostril is wider than the other and it affects my smile/ frown lines. My nose looks slanted. It looks like it is sliding off my one side of my face. I feel my best side is when I slightly turn to my left. The pictures that I have attached are of me looking as directly into the camera as possible. Any advice would be greatly appreciated.",5
2111,"
	I had been wearing breathe right nasal strips prior to my septoplasty and turbinate reduction surgery a month ago, to help me sleep. My left nostril opening is more narrow than the right and collapses in somewhat when breathing. This issue was not addressed during my surgery for deviated septum. Would it be safe to use the nasal strips now, being one month post-op, to help keep this nostril more open when sleeping?
",5
2112,"I have been diagnosed with a deviated septum.  Instead of being centrally aligned, the central part of my septum is skewed into my left nostril and according there is a larger space in my right.  If I were to get septoplasty performed, how exactly would this work?  Would the septum be restored or adjusted to a central location so that both the blockage in my left and the space in my right would be eliminated?  Or would the surgery just eliminate the blockage on the left side and leave the right essentially unchanged?",5
2119,"
	the congestion changes comes and goes throughout the day. Sometimes breathe better on right, then left. Sometimes breathe fairly clearly out of both sides. In the morning I can wake up with one side almost completely blocked, then after being up for a while it clears. My nasal passages also get really dry which adds to the feeling of congestion. I use saline regularly. I cant say that im breathing better yet than before the surgery. Is it normal to still have dry nose swelling at this point?
",5
2120,"
	Hi! I got Septoplasty + Rhinoplasty done last August. I noticed that in my left nostril, I can't breathe as well as my right. I always did have issues with this left nostril in terms of breathing and Septoplasty should have improved that. I find my left nostril to be stuffy almost all the time, and gets worse at night. Also when I breathe in heavily, it makes a weird noise. I have mentioned it to my doctor and he stated that the septum is still deviated but he doesn't need to re-operate. Help!
",5
2128,"
	Surgery 6 weeks ago. Worse than the cosmetic issues is that I cannot breathe well. Bones settled off center towards the left. Tip overcorrected towards the left. Since the day I came out of surgery I can't breathe out of my left nostril. My right side is better but not like before, I didn't have any breathing issues before. I didn't have any cartilage grafts put anywhere. Doctor told me my turbinates are swolIen but I don't buy it. Cant go a year not breathing. Fixable sooner than 1yr?
",5
2130,"
	I have had a septorhinoplasty done in which the surgeon just corrected the septum, second time he corrected nasal tip and hump was removed but asymmetry of nasal bones was not corrected at all. One side of nasal bone looks bigger and bulging than the other side from front. He says he did osteotomy on that side but i can feel the broken bone only at the part where the hump was. How can this asymmetrical nasal bone be corrected?
",5
2131,"
	Prior to my open septo-rhinoplasty, I had a dorsal hump and bumps on both lateral sides of the bony portion of the bridge. My doctor, whom I feel did a good job, took down the dorsal hump and one of the lateral bumps-- the left side to be exact. . Why would he have left the right side slightly protruding? I want to understand this better before the next visit. I trust my surgeon completely, but I won't see him until mid-June. Spreader grafts were used. 7 wks post op. Thank you for your input.
",5
